{
  "calibration_status": "calibrated under dated frozen sampled-Gaussian calibration",
  "checks": [
    {
      "atol": 7.2857312941074385e-09,
      "class": "ELEMENTWISE",
      "max_abs_err": 4.163336342344337e-17,
      "max_rel_err": 2.103591487263726e-15,
      "notes": "five-sigma interior; one nonnegative scale; identical authenticated pre-resolution cut",
      "p999_rel_err": 1.8166560829655208e-15,
      "pass": true,
      "quantity": "lithium_chain_broadened_cut",
      "requirements": [
        "chinook-sampled-gaussian-resolution-parity"
      ],
      "rtol": 0.0001
    },
    {
      "atol": 0.0,
      "class": "PEAK-SCALED",
      "max_abs_err": 4.163336342344337e-17,
      "max_rel_err": 5.714369874869752e-16,
      "notes": "max absolute error divided by Chinook interior peak",
      "p999_rel_err": 1.8166560829655208e-15,
      "pass": true,
      "quantity": "lithium_chain_peak_scaled_max_pixel",
      "requirements": [
        "chinook-sampled-gaussian-resolution-parity"
      ],
      "rtol": 1e-06
    }
  ],
  "chinook_commit": "24913de8cc5b8c162f7c1b4acc64bd1b54dd548b",
  "chinook_env_hash": "6d00cb4df251508b6392273b1df166f6a17abe8f6691cffead45c636e8ef2531",
  "date": "2026-08-10",
  "diagnostics": {
    "common_raw_integral_ratio": 1.0,
    "hamiltonian_max_abs_error_ev": 0.0,
    "matched_metrics": {
      "candidate_to_reference_integral_ratio_full_grid": 1.0000000000000002,
      "crop_cells_axis_order_ky_kx_omega": [
        0,
        5,
        13
      ],
      "elementwise_pass": true,
      "interior_shape": [
        1,
        231,
        575
      ],
      "max_absolute_error": 4.163336342344337e-17,
      "max_absolute_error_over_peak": 5.714369874869752e-16,
      "max_relative_error_above_atol": 2.103591487263726e-15,
      "p999_relative_error_above_atol": 1.8166560829655208e-15,
      "profiled_nonnegative_scale": 1.0,
      "strict_peak_scaled_pass": true
    },
    "public_long_tail_expected_peak_ratio": 2.078353654782797e-05,
    "public_long_tail_metrics_non_authoritative": {
      "candidate_to_reference_integral_ratio_full_grid": 0.999055644405111,
      "crop_cells_axis_order_ky_kx_omega": [
        0,
        5,
        13
      ],
      "elementwise_pass": false,
      "interior_shape": [
        1,
        231,
        575
      ],
      "max_absolute_error": 1.514232626259604e-06,
      "max_absolute_error_over_peak": 2.0783536547447013e-05,
      "max_relative_error_above_atol": 48.49642298148523,
      "p999_relative_error_above_atol": 0.4361479021698761,
      "profiled_nonnegative_scale": 1.000002911101699,
      "strict_peak_scaled_pass": false
    },
    "upstream_differences_not_emulated": [
      "Chinook on-shell matrix-element evaluation",
      "Chinook datacube energy-window state selection"
    ]
  },
  "diffpes_commit": "0c61e5f563668fcd1ea4c6942ca20f8350ed65e7",
  "diffpes_self_convergence": {
    "response_adapter": "closed sampled operator; no quadrature or iterative solve"
  },
  "file_hashes": {
    "chinook_output.npz": "662752487bba44084efa89ae27beb132ef3c3fc0559c64509ae3c8519f72ad67",
    "diffpes_output.npz": "593fc83e18b83b62e412b330f3ac0db65008d47e5cc4169553abff8732e99756",
    "hamiltonians.npz": "9f8b0e9f660027a519327257e0ab4b42b8a6f3a62b9065532e384d66176c2a57",
    "model_spec.json": "bf11fed1cd03bee97b255af4951b552d64ee181436492aed0c16727d6c49abbe"
  },
  "frozen": true,
  "mappings_applied": [
    "Chinook radial sampling recorded upstream of the common raw cut",
    "Single kz recorded upstream of the common raw cut",
    "Lorentzian eigenspectrum plus eta floor recorded upstream of the common raw cut",
    "matched Gaussian is the only operation under acceptance"
  ],
  "model": "lithium_chain",
  "negative_controls": {
    "wrong_energy_momentum_axis_assignment": {
      "candidate_to_reference_integral_ratio_full_grid": 1.0,
      "crop_cells_axis_order_ky_kx_omega": [
        0,
        5,
        13
      ],
      "elementwise_pass": false,
      "interior_shape": [
        1,
        231,
        575
      ],
      "max_absolute_error": 0.028756016396957518,
      "max_absolute_error_over_peak": 0.3946894997378621,
      "max_relative_error_above_atol": 1505.862487218556,
      "p999_relative_error_above_atol": 1096.773102405109,
      "profiled_nonnegative_scale": 1.0847337186541024,
      "strict_peak_scaled_pass": false
    },
    "wrong_n_minus_1_over_range": {
      "candidate_to_reference_integral_ratio_full_grid": 1.0000000000000002,
      "crop_cells_axis_order_ky_kx_omega": [
        0,
        5,
        13
      ],
      "elementwise_pass": false,
      "interior_shape": [
        1,
        231,
        575
      ],
      "max_absolute_error": 0.00012364909008256986,
      "max_absolute_error_over_peak": 0.001697140411732929,
      "max_relative_error_above_atol": 0.06683697009823192,
      "p999_relative_error_above_atol": 0.06398928784304744,
      "profiled_nonnegative_scale": 0.999660739937681,
      "strict_peak_scaled_pass": false
    }
  },
  "parity_config": {
    "broadening": "gaussian_filter",
    "constants": "chinook",
    "conventions": "chinook",
    "kz_mode": "single",
    "radial_sampling": "chinook5",
    "spectral_mode": "lorentzian_eigh"
  },
  "platform": {
    "arch": "x86_64",
    "blas": "numpy.show_config captured by exact environment identity",
    "os": "Linux-5.15.0-187-generic-x86_64-with-glibc2.35"
  },
  "run_id": "20260810T191923Z",
  "schema_version": "1.0.0",
  "scope": {
    "acceptance_input": "identical authenticated Chinook intensity_raw",
    "axis_order": [
      "ky",
      "kx",
      "omega_rel"
    ],
    "classification": "K-only response compatibility",
    "complete_shape": [
      1,
      241,
      601
    ],
    "excluded_claims": [
      "production source assembly",
      "matrix-element energy sampling",
      "state-window selection",
      "detector mapping or ordering",
      "conservation",
      "absolute intensity"
    ]
  },
  "source_authentication": {
    "adapter_sha256": "4980a4b1642b1b6ffbeb37e61290712b9775f12ead89403ad70e1ff44eb84797",
    "chinook_distribution_version": "1.1.3",
    "chinook_package_content_sha256": "e2a12678f55c74317dc7309d2a565794fecfdafaea9ab5d57d5c4a73b4aa4b94",
    "chinook_repository": "https://github.com/qmlab-ubc-ca/chinook",
    "diffpes_worktree_dirty_at_replay": true,
    "model_spec_sha256": "bf11fed1cd03bee97b255af4951b552d64ee181436492aed0c16727d6c49abbe",
    "production_source_sha256": {
      "src/diffpes/__init__.py": "e6e406b7a630da97322bb5427c87912b24630fd9ed52aa900b16d28e7c2bfd50",
      "src/diffpes/certify/__init__.py": "da0904731e2a35e8f34e31ee5055e51f21fa2794589d69a8f561da682360bee3",
      "src/diffpes/certify/builtin_transformations.py": "3fef87f68ee0886e6d7b38f2854417483d3144397d7fa5b65b23d8f7d1f1830d",
      "src/diffpes/certify/canonical.py": "7572a5f36c26519371947992325c769fa40804a2f2c9a506b4b8467c14e0075b",
      "src/diffpes/certify/checks.py": "00dc3f5d2b9ad9c338d932799b01ac035702d0fe9ac6e6bf26e752b87a43e940",
      "src/diffpes/certify/checksums.py": "000eb340d5f48244cdc65a69ad2c4454de97077a5c891f8595a3435c9a36bfe0",
      "src/diffpes/certify/contracts.py": "fe0a90ed112342cc51f35ced4e24548b10f3240ef333845944e5914e1a746b00",
      "src/diffpes/certify/dependencies.py": "a4ebcc046c90e8b259aefb2ecf6032b9c1009acd62556ab8e63d663f02001177",
      "src/diffpes/certify/evidence.py": "e24c800eb8d0e27e5916461f03c95427aa81dfa37a2647c5d19dbc51fa74b1a7",
      "src/diffpes/certify/execution.py": "7817f0c5ede0e63a008b768fcab8c64ea0a48a94096cada9beac74e7cf297d9c",
      "src/diffpes/certify/inspect.py": "07f24edaaaeb33f900e140e68d57167b74210916f8e499ff0513e258d86c1718",
      "src/diffpes/certify/models.py": "83e5554b4a32fbb292044a3c41b90e30da8ecba8406c0367cb41f9e901703b31",
      "src/diffpes/certify/policy.py": "cf595029211c76e38d4f0cfb9e8923588255fdbd201ffc7f27d5491bd19fd485",
      "src/diffpes/certify/provenance.py": "1679fe81d5f6cde2668bd6c965384a9e845f80a4e3749c953582b10c82217adb",
      "src/diffpes/certify/registry.py": "6f2d985d5b48f213a8b2e45f5b41555b63a0f7d910e54c1406b4b78742ff71ac",
      "src/diffpes/certify/registry_resources.py": "2360d88581f8aee6108d2e80a7112db151e852fbb0c22c4a2a7cc6c25cf55dfa",
      "src/diffpes/certify/reproduction.py": "504929ea11a89586d39c82578f31040973552d72c64e8e36e73fe176498b194b",
      "src/diffpes/certify/resolvers.py": "87e4e59723ae8a6b90e0fbfe10629a493df6dff75081887a2d9f3c241fb320fd",
      "src/diffpes/certify/waivers.py": "d416341bffb46edcbb4fc2e288cfbd57165d6030a98464da932926912496d8ff",
      "src/diffpes/constants/__init__.py": "716d151a331c71d7037a3ab8427647fda45852af4788ff68e8c5281af6139285",
      "src/diffpes/constants/carriers.py": "abb005e64305479bc510d7d1d25d7e49ac301eda088e33f77d981f07b286a124",
      "src/diffpes/constants/certification.py": "2a514ec8b06b1302ddbd055f6f6c1806cc669e21f00849201f1789eb48e793f5",
      "src/diffpes/constants/numerical.py": "71d2a3e74520dd5794093b1ef765bf4dd64955ff6351f1d53e47eeec4cf58560",
      "src/diffpes/constants/shared.py": "56b8f95a28d0821a18ba61ab1035c2b48a2ddd25b628acdd5670195b4d89ba10",
      "src/diffpes/constants/wannier.py": "f03154fa7835ae39a520b33bc5cc969d54721c1ccbb4fe646cf728849fae93ce",
      "src/diffpes/inout/__init__.py": "0c3d0b3c02a6686158f805673f5fbd7732eac995b5afd0b31cac9ec244a01246",
      "src/diffpes/inout/certificate.py": "01793ff2c7ff1e9eabf696812d1006ad5865e72043309f58c85098571e900225",
      "src/diffpes/inout/certificate_decoding.py": "9ff6e0d28b4b638f722d52101df547e24bf3cecd7e648682297cf0ccfd80e69d",
      "src/diffpes/inout/certificate_storage.py": "b9eb445aaeedf28f18ff3c149bed2301ec6ecd482d62568144bb8dc40a0bdd58",
      "src/diffpes/inout/chgcar.py": "dd0fce796ddfe2cd6f8c38025e92743d3f3c247a21e6b7493d673962f4980adc",
      "src/diffpes/inout/doscar.py": "da78be5658cf7c21c900240f518b90735f09eef417bcfa75ad513f88a91e802b",